{
  "schemaVersion": 2,
  "book": "yuanshi",
  "chapter": "153",
  "input": {
    "unitCount": 338,
    "chapterFingerprint": "sha256:5856bafbdc7ff5f5d4da0cb1255330a73b455a806e250b593617f18b71e2f2fb",
    "candidateScannerVersion": 2,
    "unitDigests": [
      ["s0001","62b3ff612103617191e04c1b"],
      ["s0002","f8437dd59d2aff2cc9f97bd9"],
      ["s0003","d74f993bd9bf306680c32c27"],
      ["s0004","fba319e8296720e4fb56ee24"],
      ["s0005","9e93fd36d3639cc80eb75e31"],
      ["s0006","2812d52ef282b4bf8bcb8b7a"],
      ["s0007","dcb625e1855d412f674c230c"],
      ["s0008","377e9d468539d604752ff986"],
      ["s0009","f762f5c78c16b7db25117516"],
      ["s0010","5a608a8bb2676cabc3ffb813"],
      ["s0011","12e0019f1732ab8f12cca530"],
      ["s0012","c616047a3033e2e6f1e3569e"],
      ["s0013","090eafa0d568e8cdf454f28a"],
      ["s0014","7339e64eb5fa94ca2173eb62"],
      ["s0294","fa655c36f327e1d73c4f6944"],
      ["s0295","5cb533faacd02fd12d72117d"],
      ["s0296","662937f0b56db802c91a84c5"],
      ["s0297","ac72995fb115367fd980d10c"],
      ["s0298","a9e2d86baa44242334520458"],
      ["s0299","c5eca7827cb0fb1931ae5302"],
      ["s0300","b9494561225e8ff37a1a9c24"],
      ["s0301","2377d0db440a8b269af86b03"],
      ["s0302","155892c65b17f344c93ece30"],
      ["s0303","3fb9d756fcc3d4ee0373c6d4"],
      ["s0304","b94da06669d530fad3f313f0"],
      ["s0305","907f525306cc9ad8aa8db847"],
      ["s0306","89ada048906ae67a7f8c5ab9"],
      ["s0015","bf82b460900d63bc1d15af2c"],
      ["s0016","4bb9409782083f63809b88b3"],
      ["s0017","b3b15f8c741c3c08b8b34626"],
      ["s0018","1688af0b8af104a509c2c4f4"],
      ["s0019","b8ab6dc6fcda13da2caa7c39"],
      ["s0020","a78adbfed57ebf0316fdded2"],
      ["s0021","92556beda08003df73db1afc"],
      ["s0022","eaaac1b7fe8a96d4a803122a"],
      ["s0023","06ae0cce63f4ddda84d29592"],
      ["s0024","b56d9a2a772ddd42618bb3f6"],
      ["s0025","54d3c84680bf561070c848e8"],
      ["s0026","a85da93aaa2796e4ec440739"],
      ["s0027","26a464312577dcb64248e373"],
      ["s0028","d12016ab2aa8db3f4e03c352"],
      ["s0029","e2e85b7ae90f0273c9d83ad4"],
      ["s0030","90cfa08b8706435fe751d037"],
      ["s0031","f48fc2f30ea192358a25531d"],
      ["s0032","3ba20fa7af9ba0f697704375"],
      ["s0033","9df3d8321e852f7ebda85ae4"],
      ["s0034","9563bb51a78669bf4ded17c8"],
      ["s0035","64ab2c3f3133c28df59d8985"],
      ["s0036","79a023dd819b64790068a08d"],
      ["s0037","8e5a3fab31ffd63b361df2cf"],
      ["s0038","016000ec92fa1f903daa7d1b"],
      ["s0039","5e9b25ae952e2563245d6941"],
      ["s0040","a73f738e45071dc30fdf270b"],
      ["s0041","2fb344bfc1bcd95488c95a5a"],
      ["s0042","8618c7babe6ed388d591f9b6"],
      ["s0043","66b652ae5a392a664ffb10f4"],
      ["s0044","78aa8da577142c64142f6cce"],
      ["s0045","110521a98b19ffb20ed67e1f"],
      ["s0046","a39b1df52dadbd349cf6cf7b"],
      ["s0047","fa660b5a436c7eb56d43c847"],
      ["s0048","24210ba9f448f7600801ffb9"],
      ["s0049","caaa69383426f3724864e601"],
      ["s0050","e2adc5cc15b173b26d3f697f"],
      ["s0051","9b7b82cc13fa2f2a9d225a58"],
      ["s0052","dffb6fd1645b0c6160e55fb3"],
      ["s0053","7d24788c552b9f2033b73f69"],
      ["s0054","507a5782e70dcd1c5e33bee1"],
      ["s0055","ef506aea958483a1d47b1ee7"],
      ["s0056","fa15c261d15ce1c23ff3717c"],
      ["s0057","eb76ecb8ef4e3659e1e3b3f2"],
      ["s0058","e1ce5d4a19929448b0eac1d1"],
      ["s0059","62be5f5ef25b1ff6798cc329"],
      ["s0060","5b0215bdd82ac4ac8c5aab8a"],
      ["s0061","0b274e0e94515d54b6180792"],
      ["s0062","8b13bc3b3583b32fa04875b8"],
      ["s0063","5097150aa7187283b0812864"],
      ["s0064","8ac3caf2d6605725ef17191e"],
      ["s0065","87cf47c7ef71043ec7bc81ab"],
      ["s0066","7f5736080b05461a0069c641"],
      ["s0067","ef836ae8c90be358dbff7e52"],
      ["s0068","fec90c3c253e46c8fad5f994"],
      ["s0069","1e85b841afc900c58af13984"],
      ["s0070","8efb8410c14c664463404e6f"],
      ["s0071","c9ec2d2624da8f8a88100c90"],
      ["s0072","20edc3a66e7a9f3c7c097547"],
      ["s0073","10d2e4fde29b53bd72d99fc3"],
      ["s0074","f230ba040ce0fe46045c9cf7"],
      ["s0075","cb05ca43a6f4ec32178173c9"],
      ["s0076","389e3cb6dadf5cc5953597bf"],
      ["s0077","872f896a2c83026335b6be30"],
      ["s0078","8b372b585bbe028871f52e77"],
      ["s0079","84554c040aa077a8d86ac6f5"],
      ["s0080","881f83b4d239e3a4fae3bade"],
      ["s0081","7ebe88e6ba3b37c1115e8d9e"],
      ["s0082","616f40106bfba4497b18a3b5"],
      ["s0083","bc227044b36a3beede527504"],
      ["s0084","27e2899d09666bb5341819af"],
      ["s0085","5285c547f8ae7b5cb48018c9"],
      ["s0086","c59e338bfc838411bb67af3b"],
      ["s0087","d155a072c7af0b27340ba230"],
      ["s0088","c648f808dbbe6dfa7e8ea57a"],
      ["s0089","d5213a2c80a1b955f9ecb151"],
      ["s0090","64c88a04428dc1000ade476b"],
      ["s0091","582c6960809b81f964e9387f"],
      ["s0092","e4aa63cac7880da46954b52d"],
      ["s0093","5219ac4730b793d94ed71813"],
      ["s0094","e01734106586cb3522aa82f5"],
      ["s0095","febfe0e879ceeefe6d87779e"],
      ["s0096","613096597a41cd077fa432b3"],
      ["s0097","a36c3b1d1b80046cdcbd2c4a"],
      ["s0098","bb4a48683d2229c852143bc6"],
      ["s0099","c6d53ddf081774f6663bc9da"],
      ["s0100","83db246521293b96333d4a21"],
      ["s0324","8085eb99cf7b530d1d29bdba"],
      ["s0325","74cbbe48d700f74f55f25e9f"],
      ["s0326","6e3ef9c2aeb15f0f4a3e1712"],
      ["s0327","e8b70a7b7f604afb7faf28ff"],
      ["s0328","e4aa63cac7880da46954b52d"],
      ["s0329","2b6f097e8a35a006bc5c8187"],
      ["s0330","ba0f5ab3065710ab2270f429"],
      ["s0331","086c3fa0220e52388fd133da"],
      ["s0332","8c9f468ed3e20d07ee7dcdb7"],
      ["s0333","17ed17d833b650a750eee133"],
      ["s0334","4ab9be4f98c6a447c389fa17"],
      ["s0335","4fee3e07675549c8d7d9e7b9"],
      ["s0336","d1aa3fbd1d87a09027d2bcc8"],
      ["s0337","35bab10d19ab777c5bc2389d"],
      ["s0338","51ea1247a27f76872a0023b7"],
      ["s0101","b6e472f9e2c58ad6cd0880f5"],
      ["s0102","bc26800b28188e1d9e1d7417"],
      ["s0103","d399c8be0046aa5c67949206"],
      ["s0104","d9a1da37c2c6e971cd66441e"],
      ["s0105","cd5575ac5a7e8b69af772604"],
      ["s0106","adb492e695934aca981e4602"],
      ["s0107","d4277691537452c9c02e16a6"],
      ["s0108","930bf3f0199e60172492818d"],
      ["s0109","c1c99c68096dc0abac7c95fd"],
      ["s0110","d30f39a000c6a0b31b74368b"],
      ["s0111","ac8bc2cd565760946b7573e2"],
      ["s0112","b270d95561c2d5e99a0c0d11"],
      ["s0113","cd0786f70a85834c224c32a7"],
      ["s0114","7b9b5218983fb0c5ffed63cf"],
      ["s0115","18d39693260a19edb2aed4d1"],
      ["s0116","a0e15ce160d859e96ee29694"],
      ["s0117","ffd852b073cc7bcf9902035f"],
      ["s0118","c1340ebd4161652c67afaed1"],
      ["s0119","378034db148ff7d629cceee2"],
      ["s0120","321407c33b5fd41e5af46c6e"],
      ["s0121","a2e4dbbda733a79d1b38c968"],
      ["s0122","321e652ecda3de0c7efff3f8"],
      ["s0123","f33d26f3c7614ce2e2537408"],
      ["s0124","25376daeb054932e6653386c"],
      ["s0125","a5958812b8221c2dc4d0a65f"],
      ["s0126","ab5519923984d24217599fb5"],
      ["s0307","ea4468e9d05f09fd4ba6ba8b"],
      ["s0308","f51f8b9a938f1a5a291b04e3"],
      ["s0309","ba8c6b581279b72432dc6a21"],
      ["s0310","ac227e9d33c32151be4d5ff0"],
      ["s0311","34b993f8158885533df5e6ea"],
      ["s0312","a8ba6e3fcdb99370548555c5"],
      ["s0313","81e6c1b5459500bc80f92355"],
      ["s0127","9490657c82858c0b56000997"],
      ["s0128","f53635c52587dce2bc352b40"],
      ["s0129","10600e0ace467b54810e3b66"],
      ["s0130","0454f105e92c2555de7640a3"],
      ["s0131","d913681918694870741ef187"],
      ["s0132","c188fc22e6ccd4f5d84c8af8"],
      ["s0133","05d8473699ca2edd25a5fe0f"],
      ["s0134","6e219bf3b0d217436004aca6"],
      ["s0135","aea187615c8072d3acb5d8b2"],
      ["s0136","941e62492e8faea5fea935c8"],
      ["s0137","db8ef949d70663c2387a4411"],
      ["s0138","3928c05e5e001e640433ec86"],
      ["s0139","783f13bd5e1f75255e17412f"],
      ["s0140","9372e0381d4136806b528098"],
      ["s0141","942170c818e5d154a0707799"],
      ["s0142","7e5effa8e933a32c57448ff7"],
      ["s0143","b787bf5aed4194814bdf1120"],
      ["s0144","75eae2862d6ab37a3c0a02ff"],
      ["s0145","44922b5211678b7c62d4eb23"],
      ["s0146","03081a2b2183c0d13fefb01b"],
      ["s0147","7e1bb7c0f57de21b9c33ab5c"],
      ["s0148","590b254570b3dcae1148fc04"],
      ["s0149","cbd2c6d2947896ea5b3d43d1"],
      ["s0150","f1aa9ba55b17e55ac691cf60"],
      ["s0151","ce2cc4f331d87ea48a706cf5"],
      ["s0152","637364a7b30d8795698944dc"],
      ["s0153","9e4ecc467843e0a2870ba3e8"],
      ["s0154","d5746d7e56883a3f08c7edf2"],
      ["s0155","2774afa4ba1e040895c6fb0b"],
      ["s0156","87dcff012cc593d7f3348846"],
      ["s0157","34686671a9b127f59bec93f7"],
      ["s0158","721a4ab0b233ee2cb710cb82"],
      ["s0159","8e0f7c43215c5b964c22d84f"],
      ["s0160","d28e524db1f4932668209cc3"],
      ["s0161","0b7801cda24c15a5eb08467a"],
      ["s0162","b2bbde66b5f792772fc934a2"],
      ["s0163","d8b4c62f7d9b1046c09752d6"],
      ["s0164","651cf86812d6a280c2bd8d03"],
      ["s0165","63d0fe9cbfa95d4c9b34626a"],
      ["s0166","e3ed54fcc220a640a3754336"],
      ["s0167","90b00e0e57c7e41e25f9eaa6"],
      ["s0168","2f04d552051d079cf587f5d4"],
      ["s0169","c1927270a1f92fba9772ccaf"],
      ["s0170","18ea8b5d281e692c7e98eb2f"],
      ["s0171","18d6e14f0cff0f4c2832efa6"],
      ["s0172","da6868e58fc1d9c98c00e7db"],
      ["s0173","8a1a4a46377d77e81f3037c3"],
      ["s0174","8e2427109f350e2e58296fec"],
      ["s0175","2077faf41e8bbf0c6b6b0bd4"],
      ["s0176","4d1c25f12f5bab0c5ad3a6a6"],
      ["s0177","1a6842b851057c6c5c935e99"],
      ["s0178","61a679e5fa67f1079b8f9d9f"],
      ["s0179","1b1630403f3558272532f8eb"],
      ["s0180","71a32ea2a0750a0c22baa658"],
      ["s0181","c4bbb5852be7a86373c5fe3c"],
      ["s0182","30496056bd1011cbef23e603"],
      ["s0183","15c167ecd40886fb578ef352"],
      ["s0184","d20ebcf8f1b6b47363db7299"],
      ["s0185","927e02eb152f9cde0c53ca34"],
      ["s0186","1fc96216a01f11d8cbfadca0"],